Huisuanzhang,$1.28 ,5/24/21,2021,China,Fintech,"IDG Capital, Gaocheng Capital, Chuanrong Capital",IDG Capital,3,,,,,
WTOIP,$1.27 ,4/8/18,2018,China,Internet software & services,"Dark Horse Technology Group, Hopu Investment Management, Kefa Capital",Dark Horse Technology Group,3,,,,,
Kuaikan Manhua,$1.25 ,12/1/17,2017,China,Internet software & services,"Sequoia Capital China, CMC Capital Partners, Tencent Holdings",Sequoia Capital China,3,,,,,
BigID,$1.25 ,12/16/20,2020,United States,Cybersecurity,"BOLDstart Ventures, SAP.iO Fund, Scale Venture Partners",BOLDstart Ventures,3,,,,,
Marshmallow,$1.25 ,9/8/21,2021,United Kingdom,Fintech,"Passion Capital, Hedosophia, Outrun Ventures",Passion Capital,3,,,,,
Honor Technology,$1.25 ,10/5/21,2021,United States,Internet software & services,"Andreessen Horowitz, Prosus Ventures, Thrive Capital",Andreessen Horowitz,3,,,,,
Mythical Games,$1.25 ,11/4/21,2021,United States,Internet software & services,"Javelin Venture Partners, Struck Capital, Alumni Ventures Group",Javelin Venture Partners,3,,,,,
Incode Technologies,$1.25 ,12/7/21,2021,United States,Cybersecurity,"Dila Capital, Framework Ventures, 3L",Dila Capital,3,,,,,
Tackle.io,$1.25 ,12/21/21,2021,United States,Internet software & services,"Andreessen Horowitz, Bessemer Venture Partners, Coatue Management",Andreessen Horowitz,3,,,,,
BrewDog,$1.24 ,4/10/17,2017,United Kingdom,Consumer & retail,"TSG Consumer Partners, Crowdcube",TSG Consumer Partners,2,,,,,
Enflame,$1.24 ,1/5/21,2021,China,Hardware,"Tencent Holdings, Delta Capital, Redpoint Ventures China",Tencent Holdings,3,,,,,
EQRx,$1.23 ,1/11/21,2021,United States,Health,"Nextech Invest, Casdin Capital, Google Ventures",Nextech Invest,3,,,,,
Nexii,$1.23 ,9/8/21,2021,Canada,Other,"Trane Technologies, Honeywell",Trane Technologies,2,,,,,
BlockDaemon,$1.23 ,9/21/21,2021,United States,Fintech,"BOLDstart Ventures, Lerer Hippeau, Kenetic Capital",BOLDstart Ventures,3,,,,,
GalaxySpace,$1.22 ,11/17/20,2020,China,Mobile & telecommunications,"Shunwei Capital Partners, 5Y Capital, Legend Capital",Shunwei Capital Partners,3,,,,,
Spiber,$1.22 ,9/8/21,2021,Japan,Other,"Cool Japan Fund, JAFCO, The Carlyle Group",Cool Japan Fund,3,,,,,
Yiguo,$1.20 ,11/9/16,2016,China,"Supply chain, logistics, & delivery","Alibaba Group, KKR, Goldman Sachs",Alibaba Group,3,,,,,
Fair,$1.20 ,12/20/18,2018,United States,Auto & transportation,"CreditEase Fintech Investment Fund, BMW i Ventures, SoftBank Group",CreditEase Fintech Investment Fund,3,,,,,
Glossier,$1.20 ,3/19/19,2019,United States,Consumer & retail,"Forerunner Ventures, Institutional Venture Partners, Thrive Capital",Forerunner Ventures,3,,,,,
Workhuman,$1.20 ,6/23/20,2020,Ireland,Internet software & services,ICG,#VALUE!,1,,,,,
Qumulo,$1.20 ,7/16/20,2020,United States,Data management & analytics,"Madrona Venture Group, Kleiner Perkins Caufield & Byers, Highland Capital Partners",Madrona Venture Group,3,,,,,
Starburst,$1.20 ,1/6/21,2021,United States,Data management & analytics,"Index Ventures, Coatue Management, Andreessen Horowitz",Index Ventures,3,,,,,
Tealium,$1.20 ,2/3/21,2021,United States,Internet software & services,"Georgian Partners, Silver Lake, Presidio Ventures",Georgian Partners,3,,,,,
Public,$1.20 ,2/17/21,2021,United States,Fintech,"Accel, Greycroft, Advancit Capital",Accel,3,,,,,
Axonius,$1.20 ,3/1/21,2021,United States,Cybersecurity,"Vertex Ventures Israel, Bessemer Venture Partners, Emerge",Vertex Ventures Israel,3,,,,,
Savage X Fenty,$1.20 ,3/16/21,2021,United States,E-commerce & direct-to-consumer,"Speedinvest, Valar Ventures, Uniqa Ventures",Speedinvest,3,,,,,
Pipa Coding,$1.20 ,3/25/21,2021,China,Edtech,"Source Code Capital, XVC Venture Capital, Hillhouse Capital Management",Source Code Capital,3,,,,,
Pilot.com,$1.20 ,3/26/21,2021,United States,Fintech,"Index Ventures, Sequoia Capital, Bezos Expeditions",Index Ventures,3,,,,,
Aibee,$1.20 ,4/13/21,2021,China,Artificial intelligence,"Sequoia Capital China, Lenovo Capital and Incubator, Group GSR Ventures",Sequoia Capital China,3,,,,,
Vectra Networks,$1.20 ,4/29/21,2021,United States,Artificial intelligence,"IA Ventures, Khosla Ventures, AME Cloud Ventures",IA Ventures,3,,,,,
Ada Support,$1.20 ,5/7/21,2021,Canada,Artificial intelligence,"Version One Ventures, Bessemer Venture Partners, FirstMark Capital",Version One Ventures,3,,,,,
Inari,$1.20 ,5/12/21,2021,United States,Other,"Flagship Pioneering, Alexandria Venture Investments, Investment Corporation of Dubai",Flagship Pioneering,3,,,,,
DailyPay,$1.20 ,5/18/21,2021,United States,Fintech,"RPM Ventures, Inspiration Ventures, Carrick Capital Partners",RPM Ventures,3,,,,,
Project44,$1.20 ,6/1/21,2021,United States,"Supply chain, logistics, & delivery","Emergence Capital Partners, 8VC, Chicago Ventures",Emergence Capital Partners,3,,,,,
Oda,$1.20 ,6/2/21,2021,Norway,E-commerce & direct-to-consumer,"Kinnevik, Softbank Group, Prosus Ventures",Kinnevik,3,,,,,
Alation,$1.20 ,6/3/21,2021,United States,Internet software & services,"Costanoa Ventures, Data Collective, Salesforce Ventures",Costanoa Ventures,3,,,,,
Forto,$1.20 ,6/21/21,2021,Germany,"Supply chain, logistics, & delivery","Cherry Ventures, Northzone Ventures, Global Founders Capital",Cherry Ventures,3,,,,,
SmartMore,$1.20 ,6/24/21,2021,China,Artificial Intelligence,"IDG Capital, ZhenFund, Sequoia Capital China",IDG Capital,3,,,,,
Rohlik,$1.20 ,7/1/21,2021,Czech Republic,"Supply chain, logistics, & delivery","Partech Partners, Index Ventures, Quadrille Capital",Partech Partners,3,,,,,
Prime Medicine,$1.20 ,7/13/21,2021,United States,Health,"Newpath Partners, Google Ventures, F-Prime Capital",Newpath Partners,3,,,,,
FloQast,$1.20 ,7/21/21,2021,United States,Fintech,"Polaris Partners, Insight Partners, Norwest Venture Partners",Polaris Partners,3,,,,,
MindTickle,$1.20 ,8/3/21,2021,United States,Internet software & services,"Qualcomm Ventures, Accel, Canaan Partners",Qualcomm Ventures,3,,,,,
UpGrad,$1.20 ,8/9/21,2021,India,Edtech,"Qualcomm Ventures, Accel, Canaan Partners",Qualcomm Ventures,3,,,,,
Offchain Labs,$1.20 ,8/31/21,2021,United States,Internet software & services,"Pantera Capital, Polychain Capital, Lightspeed Venture Partners",Pantera Capital,3,,,,,
Copado,$1.20 ,9/13/21,2021,Spain,Data management & analytics,"Insight Partners, Salesforce Ventures, Perpetual Investors",Insight Partners,3,,,,,
GrubMarket,$1.20 ,9/14/21,2021,United States,E-commerce & direct-to-consumer,"GGV Capital, BlackRock, ACE & Company",GGV Capital,3,,,,,
Gem,$1.20 ,9/28/21,2021,United States,Internet software & services,"Accel, Greylock Partners, Meritech Capital Partners",Accel,3,,,,,
CarDekho,$1.20 ,10/13/21,2021,India,E-commerce & direct-to-consumer,"Sequoia Capital India, Hillhouse Capital Management, Sunley House Capital Management",Sequoia Capital India,3,,,,,
MyGlamm,$1.20 ,11/10/21,2021,India,E-commerce & direct-to-consumer,"L'Occitane, Trifecta Capital, Bessemer Venture Partners",L'Occitane,3,,,,,
Jokr,$1.20 ,12/2/21,2021,United States,E-commerce & direct-to-consumer,"GGV Capital, Tiger Global Management, Greycroft",GGV Capital,3,,,,,
AgentSync,$1.20 ,12/7/21,2021,United States,Fintech,"Craft Ventures, Caffeinated Capital, Operator Collective",Craft Ventures,3,,,,,
Merama,$1.20 ,12/9/21,2021,Mexico,E-commerce & direct-to-consumer,"SoftBank Latin America Fund, Advent International, Balderton Capital",SoftBank Latin America Fund,3,,,,,
L&P Cosmetic,$1.19 ,1/1/16,2016,South Korea,Consumer & retail,CDIB Capital,#VALUE!,1,,,,,
Unisound,$1.19 ,7/19/18,2018,China,Artificial intelligence,"Qiming Venture Partners, China Internet Investment Fund, Qualcomm Ventures",Qiming Venture Partners,3,,,,,
Mininglamp Technology,$1.19 ,3/27/19,2019,China,Artificial intelligence,"Russia-China Investment Fund, Tencent Holdings, Sequoia Capital China",Russia-China Investment Fund,3,,,,,
Luoji Siwei,$1.18 ,7/20/17,2017,China,Edtech,"Sequoia Capital China, Qiming Venture Partners, Tencent Holdings",Sequoia Capital China,3,,,,,
Yimidida,$1.17 ,1/14/19,2019,China,"Supply chain, logistics, & delivery","Source Code Capital, Global Logistic Properties, K2VC",Source Code Capital,3,,,,,
Modern Health,$1.17 ,2/11/21,2021,United States,Health,"Kleiner Perkins Caufield & Byers, Afore Capital, Founders Fund",Kleiner Perkins Caufield & Byers,3,,,,,
IRL,$1.17 ,6/15/21,2021,United States,Internet software & services,"Goodwater Capital, Floodgate, Founders Fund",Goodwater Capital,3,,,,,
Tuhu,$1.16 ,9/15/18,2018,China,Auto & transportation,"Qiming Venture Partners, Yaxia Automobile, Far East Horizon",Qiming Venture Partners,3,,,,,
SVOLT Energy,$1.16 ,6/8/20,2020,China,Auto & transportation,"IDG Capital, Bank Of China Group Investment,, SDIC CMC Investment Management",IDG Capital,4,,,,,
LifeMiles,$1.15 ,7/13/15,2015,Colombia,Other,Advent International,#VALUE!,1,,,,,
Venafi,$1.15 ,12/10/20,2020,United States,Cybersecurity,"Pelion Venture Partners, Foundation Capital, Thoma Bravo",Pelion Venture Partners,3,,,,,
Guideline,$1.15 ,6/16/21,2021,United States,Fintech,"Pelion Venture Partners, Foundation Capital, Thoma Bravo",Pelion Venture Partners,3,,,,,
Rebellion Defense,$1.15 ,9/16/21,2021,United States,Artificial intelligence,"Venrock, Innovation Endeavors, Insights Partners",Venrock,3,,,,,
Elemy,$1.15 ,10/6/21,2021,United States,Health,"General Catalyst, Bling Capital, Felicis Ventures",General Catalyst,3,,,,,
CloudBees,$1.15 ,12/9/21,2021,United States,Data management & analytics,"Matrix Partners, Lightspeed Venture Partners, Verizon Ventures",Matrix Partners,3,,,,,
Doctolib,$1.14 ,3/19/19,2019,France,Health,"BPI France, Kerala Ventures, Accel",BPI France,3,,,,,
STORD,$1.13 ,9/13/21,2021,United States,"Supply chain, logistics, & delivery","Dynamo VC, Susa Ventures, Founders Fund",Dynamo VC,3,,,,,
TELD,$1.12 ,12/16/19,2019,China,Fintech,"China Reform Fund, Gaopeng Capital, Jinhui Xingye",China Reform Fund,3,,,,,
TangoMe,$1.10 ,3/20/14,2014,United States,Mobile & telecommunications,"Draper Fisher Jurtson, Qualcomm Ventures, Alibaba Group",Draper Fisher Jurtson,3,,,,,
AppDirect,$1.10 ,10/7/15,2015,United States,E-commerce & direct-to-consumer,"Mithril, iNovia Capital, Foundry Group",Mithril,3,,,,,
Juanpi,$1.10 ,4/14/16,2016,China,E-commerce & direct-to-consumer,"Tiantu Capital, SAIF Partners China, Newsion Venture Capital",Tiantu Capital,3,,,,,
OVH,$1.10 ,8/15/16,2016,France,Other,"KKR, TowerBrook Capital Partners",KKR,2,,,,,
Eat Just,$1.10 ,11/30/17,2017,United States,Consumer & retail,"Khosla Ventures, Horizons Ventures, Founders Fund",Khosla Ventures,3,,,,,
GetYourGuide,$1.10 ,5/16/19,2019,Germany,Travel,"Spark Capital, Highland Europe, Sunstone Capital",Spark Capital,3,,,,,
Ivalua,$1.10 ,5/21/19,2019,United States,Fintech,"Ardian, Tiger Global Management, KKR",Ardian,3,,,,,
Sisense,$1.10 ,1/9/20,2020,United States,Data management & analytics,"Opus Capital, Genesis Partners, Battery Ventures",Opus Capital,3,,,,,
Pharmapacks,$1.10 ,11/12/20,2020,United States,E-commerce & direct-to-consumer,The Carlyle Group,#VALUE!,1,,,,,
Sennder,$1.10 ,1/14/21,2021,Germany,"Supply chain, logistics, & delivery","Accelm Scania Growth Capital, Lakestar",Accelm Scania Growth Capital,2,,,,,
Nexthink,$1.10 ,2/8/21,2021,Switzerland,Data management & analytics,"Auriga, Galeo Ventures, Highland Europe",Auriga,3,,,,,
Zego,$1.10 ,3/9/21,2021,United Kingdom,Fintech,"LocalGlobe, Balderton Capital, Target Global",LocalGlobe,3,,,,,
Rightway,$1.10 ,3/30/21,2021,United States,Health,"Thrive Capital, Khosla Ventures, Tiger Global Management",Thrive Capital,3,,,,,
HoneyBook,$1.10 ,5/4/21,2021,United States,Internet software & services,"Norwest Venture Partners, Hillsven Capital, Aleph",Norwest Venture Partners,3,,,,,
Sunbit,$1.10 ,5/20/21,2021,United States,Fintech,"Zeev Ventures, Group11, Chicago Ventures",Zeev Ventures,3,,,,,
Qingting FM,$1.10 ,6/2/21,2021,China,Internet software & services,"China Culture Industrial Investment Fund, We Capital, China Minsheng Investment Group",China Culture Industrial Investment Fund,3,,,,,
Amber Group,$1.10 ,6/21/21,2021,Hong Kong,Fintech,"Tiger Global Management, Tiger Brokers, DCM Ventures",Tiger Global Management,3,,,,,
G2,$1.10 ,6/22/21,2021,United States,Internet software & services,"Pritzker Group Venture Capital, Accel, Hyde Park Venture Partners",Pritzker Group Venture Capital,3,,,,,
CoinDCX,$1.10 ,8/10/21,2021,India,Fintech,"Polychain Capital, Coinbase Ventures, Jump Capital",Polychain Capital,3,,,,,
People.ai,$1.10 ,8/11/21,2021,United States,Internet software & services,"GGV Capital, Lightspeed Venture Partners, ICONIQ Capital",GGV Capital,3,,,,,
Carousell,$1.10 ,9/15/21,2021,Singapore,E-commerce & direct-to-consumer,"500 Global, Rakuten Ventures, Golden Gate Ventures",500 Global,3,,,,,
apna,$1.10 ,9/15/21,2021,India,Internet software & services,"Sequoia Capital India, Rocketship.vc, Lightspeed India Partners",Sequoia Capital India,3,,,,,
Karat,$1.10 ,10/13/21,2021,United States,Internet software & services,"8VC, Norwest Venture Partners, Tiger Global Management",8VC,3,,,,,
Enpal,$1.10 ,10/18/21,2021,Germany,Internet software & services,"HV Capital, Softbank Group, BlackRock",HV Capital,3,,,,,
Acko General Insurance,$1.10 ,10/18/21,2021,India,Fintech,"Intact Ventures, Munich Re Ventures, General Atlantic",Intact Ventures,3,,,,,
Daily Harvest,$1.10 ,11/16/21,2021,United States,E-commerce & direct-to-consumer,"M13, Lightspeed Venture Partners, Lone Pine Capital",M13,3,,,,,
The Bank of London,$1.10 ,11/30/21,2021,United Kingdom,Fintech,"Mangrove Capital Partners,14W. ForgeLight",Mangrove Capital Partners,2,,,,,
Fundbox,$1.10 ,11/30/21,2021,United States,Fintech,"Khosla Ventures, General Catalyst, Blumberg Capital",Khosla Ventures,3,,,,,
Turing,$1.10 ,12/20/21,2021,United States,Internet software & services,"Foundation Capital, Frontier Ventures, AltaIR Capital",Foundation Capital,3,,,,,
GlobalBees,$1.10 ,12/28/21,2021,India,E-commerce & direct-to-consumer,"Chiratae Ventures, SoftBank Group, Trifecta Capital",Chiratae Ventures,3,,,,,
Nxin,$1.08 ,9/18/18,2018,China,Internet software & services,"Beijing Juneng Hesheng Industry Investment Fund, Beijing Shuju Xinrong Fund",Beijing Juneng Hesheng Industry Investment Fund,2,,,,,
UISEE Technology,$1.08 ,1/25/21,2021,China,"Supply chain, logistics, & delivery","Shenzhen Capital Group, Robert Bosch Venture Capital, SeptWolves Ventures",Shenzhen Capital Group,3,,,,,
56PINGTAI,$1.08 ,1/25/21,2021,China,"Supply chain, logistics, & delivery","QF Capital, QC Capital, Unicom Innovation Venture Capital",QF Capital,3,,,,,
Rubicon Global,$1.07 ,8/25/17,2017,United States,Other,"Goldman Sachs, Leonardo DiCaprio, Promecap",Goldman Sachs,3,,,,,
Radius Payment Solutions,$1.07 ,11/27/17,2017,United Kingdom,Fintech,Inflexion Private Equity,#VALUE!,1,,,,,
Rivigo,$1.07 ,7/11/19,2019,India,"Supply chain, logistics, & delivery","SAIF Partners India, Warburg Pincus, Trifecta Capital Advisors",SAIF Partners India,3,,,,,
Mamaearth,$1.07 ,12/28/21,2021,India,E-commerce & direct-to-consumer,"Fireside Ventures, Sequoia Capital India, Stellaris Venture Partners",Fireside Ventures,3,,,,,
Jiuxian,$1.05 ,7/30/15,2015,China,E-commerce & direct-to-consumer,"Sequoia Capital China, Rich Land Capital, Merrysunny Wealth",Sequoia Capital China,3,,,,,
Instabase,$1.05 ,10/21/19,2019,United States,Data management & analytics,"New Enterprise Associates, Greylock Partners, Andreessen Horowitz",New Enterprise Associates,3,,,,,
Hesai Tech,$1.05 ,8/1/20,2020,China,Artificial intelligence,"Lightspeed China Partners, Baidu Ventures, Qiming Venture Partners",Lightspeed China Partners,3,,,,,
Proterra,$1.05 ,10/15/20,2020,United States,"Supply chain, logistics, & delivery","GM Ventures, VentureSouth, Kleiner Perkins Caufield & Byers",GM Ventures,3,,,,,
Sendbird,$1.05 ,4/6/21,2021,United States,Mobile & telecommunications,"FundersClub, Y Combinator, Tiger Global Management",FundersClub,3,,,,,
Density,$1.05 ,11/10/21,2021,United States,Hardware,"Founders Fund, Upfront Ventures, 01 Advisors",Founders Fund,3,,,,,
Mixpanel,$1.05 ,11/15/21,2021,United States,Internet software & services,"Bain Capital Tech Opportunities, Andreessen Horowitz, Sequoia Capital",Bain Capital Tech Opportunities,3,,,,,
Aprogen,$1.04 ,5/31/19,2019,South Korea,Health,"Lindeman Asia Investment, Nichi-Iko Pharmaceutical",Lindeman Asia Investment,2,,,,,
OrCam Technologies,$1.03 ,2/20/18,2018,Israel,Artificial intelligence,"Intel Capital, Aviv Venture Capital",Intel Capital,2,,,,,
Leap Motor,$1.01 ,11/20/18,2018,China,Auto & transportation,"Sequoia Capital China, Gopher Asset Management, Shanghai Electric Group",Sequoia Capital China,3,,,,,
Grofers,$1.01 ,6/30/21,2021,India,"Supply chain, logistics, & delivery","Tiger Global Management, Sequoia Capital India, SoftBank Group",Tiger Global Management,3,,,,,
Lookout,$1.00 ,10/10/13,2013,United States,Cybersecurity,"Accel Partners, Greylock Partners, Lowercase Capital",Accel Partners,3,,,,,
Snapdeal,$1.00 ,5/21/14,2014,India,E-commerce & direct-to-consumer,"SoftBankGroup, Blackrock, Alibaba Group",SoftBankGroup,3,,,,,
TechStyle Fashion Group,$1.00 ,8/29/14,2014,United States,E-commerce & direct-to-consumer,"Matrix Partners, Passport Capital, Rho Ventures",Matrix Partners,3,,,,,
InMobi,$1.00 ,12/2/14,2014,India,Mobile & telecommunications,"Kleiner Perkins Caufield & Byers, Softbank Corp., Sherpalo Ventures",Kleiner Perkins Caufield & Byers,3,,,,,
LinkSure Network,$1.00 ,1/1/15,2015,China,Mobile & telecommunications,N/A,#VALUE!,1,,,,,
Red Ventures,$1.00 ,1/7/15,2015,United States,Other,"Silver Lake Partners, General Atlantic",Silver Lake Partners,2,,,,,
BeiBei,$1.00 ,1/22/15,2015,China,E-commerce & direct-to-consumer,"Banyan Capital, New Horizon Capital, IDG Capital Partners",Banyan Capital,3,,,,,
Lamabang,$1.00 ,3/6/15,2015,China,E-commerce & direct-to-consumer,"5Y Capital, Matrix Partners China, K2VC",5Y Capital,3,,,,,
JimuBox,$1.00 ,4/21/15,2015,China,Fintech,"Matrix Partners China, Ventech China, Shunwei Capital Partners",Matrix Partners China,3,,,,,
BenevolentAI,$1.00 ,6/2/15,2015,United Kingdom,Artificial intelligence,Woodford Investment Management,#VALUE!,1,,,,,
FXiaoKe,$1.00 ,7/2/15,2015,China,Mobile & telecommunications,"IDG Capital, Northern Light Venture Capital, DCM Ventures",IDG Capital,3,,,,,
Vox Media,$1.00 ,8/12/15,2015,United States,Internet software & services,"Accel Partners, Comcast Ventures, General Atlantic",Accel Partners,3,,,,,
Mia.com,$1.00 ,9/8/15,2015,China,E-commerce & direct-to-consumer,"Sequoia Capital China, ZhenFund, K2 Ventures",Sequoia Capital China,3,,,,,
58 Daojia,$1.00 ,10/12/15,2015,China,Internet software & services,"KKR, Alibaba Group, Ping An Insurance",KKR,3,,,,,
Womai,$1.00 ,10/12/15,2015,China,E-commerce & direct-to-consumer,"SAIF Partners China, Baidu, IDG Capital",SAIF Partners China,3,,,,,
HuJiang,$1.00 ,10/29/15,2015,China,Edtech,"China Minsheng Investment, Baidu, Wanxin Media",China Minsheng Investment,3,,,,,
iTutorGroup,$1.00 ,11/18/15,2015,China,Edtech,"QiMing Venture Partners, Temasek Holdings, Silverlink Capital",QiMing Venture Partners,3,,,,,
MindMaze,$1.00 ,1/28/16,2016,Switzerland,Health,Hinduja Group,#VALUE!,1,,,,,
iCarbonX,$1.00 ,4/12/16,2016,China,Artificial intelligence,"Tencent, Vcanbio",Tencent,2,,,,,
SMS Assist,$1.00 ,6/7/16,2016,United States,Internet software & services,"Goldman Sachs, Insights Venture Partners, Pritzker Group Venture Capital",Goldman Sachs,3,,,,,
Kendra Scott,$1.00 ,12/21/16,2016,United States,Consumer & retail,"Berkshire Partners, Norwest Venture Partners",Berkshire Partners,2,,,,,
Mobvoi,$1.00 ,4/6/17,2017,China,Consumer & retail,"Sequoia Capital China, SIG Asia Investments, ZhenFund",Sequoia Capital China,3,,,,,
Zhuan Zhuan,$1.00 ,4/18/17,2017,China,E-commerce & direct-to-consumer,"58.com, Tencent Holdings",58.com,2,,,,,
Modernizing Medicine,$1.00 ,5/10/17,2017,United States,Health,"Warburg Pincus, Summit Partners, Sands Capital",Warburg Pincus,3,,,,,
Zhaogang,$1.00 ,6/29/17,2017,China,E-commerce & direct-to-consumer,"K2 Ventures, Matrix Partners China, IDG Capital",K2 Ventures,3,,,,,
DianRong,$1.00 ,8/2/17,2017,China,E-commerce & direct-to-consumer,"Standard Chartered, FinSight Ventures, Affirma Capital",Standard Chartered,3,,,,,
Cell C,$1.00 ,8/7/17,2017,South Africa,Mobile & telecommunications,"Blue Label Telecoms, Net1 UEPS Technologies",Blue Label Telecoms,2,,,,,
YH Global,$1.00 ,9/21/17,2017,China,"Supply chain, logistics, & delivery","Co-Energy Finance, Grandland",Co-Energy Finance,2,,,,,
Revolution Precrafted,$1.00 ,10/23/17,2017,Philippines,Other,"K2 Global, 500 Startups",K2 Global,2,,,,,
WeLab,$1.00 ,11/8/17,2017,Hong Kong,Fintech,"Sequoia Capital China, ING, Alibaba Entrepreneurs Fund",Sequoia Capital China,3,,,,,
Maimai,$1.00 ,11/15/17,2017,China,Mobile & telecommunications,"Morningside Venture Capital, IDG Capital, DCM Ventures",Morningside Venture Capital,3,,,,,
Dxy.cn,$1.00 ,4/10/18,2018,China,Health,"Tencent Holdings, DCM Ventures",Tencent Holdings,2,,,,,
Orbbec Technology,$1.00 ,5/21/18,2018,China,Hardware,"R-Z Capital, Green Pine Capital Partners, SAIF Partners China",R-Z Capital,3,,,,,
HMD Global,$1.00 ,5/21/18,2018,Finland,Mobile & telecommunications,Ginko Ventures,#VALUE!,1,,,,,
Huike Group,$1.00 ,5/24/18,2018,China,Edtech,"Fosun RZ Capital, Oceanwide Holdings, Shenzhen Qianhe Capital Management Co.",Fosun RZ Capital,3,,,,,
China Cloud,$1.00 ,6/11/18,2018,China,Hardware,"V Star Capital, GF Xinde Investment Management Co., Haitong Leading Capital Management",V Star Capital,3,,,,,
LinkDoc Technology,$1.00 ,7/5/18,2018,China,Health,"China Investment Corporation, New Enterprise Associates",China Investment Corporation,2,,,,,
MediaMath,$1.00 ,7/10/18,2018,United States,Internet software & services,"Silicon Valley Bank, QED Investors, European Founders Fund",Silicon Valley Bank,3,,,,,
Movile,$1.00 ,7/12/18,2018,Brazil,Mobile & telecommunications,"Innova Capital - FIP, 3G Capital Management, Prosus Ventures",Innova Capital - FIP,3,,,,,
Kuaigou Dache,$1.00 ,7/13/18,2018,China,"Supply chain, logistics, & delivery","Sequoia Capital China, InnoVision Capital, Qianhai Fund of Funds",Sequoia Capital China,3,,,,,
Pat McGrath Labs,$1.00 ,7/16/18,2018,United States,Consumer & retail,"One Luxury Group, Eurazeo",One Luxury Group,2,,,,,
Wacai,$1.00 ,7/18/18,2018,China,Mobile & telecommunications,"Qiming Venture Partners, China Broadband Capital, CDH Investments",Qiming Venture Partners,3,,,,,
FlashEx,$1.00 ,8/27/18,2018,China,"Supply chain, logistics, & delivery","Prometheus Capital, Matrix Partners China, JD Capital Management",Prometheus Capital,3,,,,,
Branch,$1.00 ,9/10/18,2018,United States,Mobile & telecommunications,"New Enterprise Associates, Pear, Cowboy Ventures",New Enterprise Associates,3,,,,,
Banma Network Technologies,$1.00 ,9/13/18,2018,China,Auto & transportation,"Yunfeng Capital, SDIC Innovation Investment Management, Shang Qi Capital",Yunfeng Capital,3,,,,,
Tresata,$1.00 ,10/10/18,2018,United States,Fintech,GCP Capital Partners,#VALUE!,1,,,,,
Momenta,$1.00 ,10/17/18,2018,China,Artificial intelligence,"Sinovation Ventures, Tencent Holdings, Sequoia Capital China",Sinovation Ventures,3,,,,,
Hosjoy,$1.00 ,10/18/18,2018,China,E-commerce & direct-to-consumer,"U.S.-China Green Fund, Founder H Fund, Richland Equities",U.S.-China Green Fund,3,,,,,
Omio,$1.00 ,10/23/18,2018,Germany,Travel,"Lakestar, Battery Ventures, New Enterprise Associates",Lakestar,3,,,,,
TERMINUS Technology,$1.00 ,10/25/18,2018,China,Hardware,"China Everbright Limited, IDG Capital, iFLYTEK",China Everbright Limited,3,,,,,
BitFury,$1.00 ,11/6/18,2018,Netherlands,Hardware,"Georgian Co-Investment Fund, iTech Capital, Galaxy Digital",Georgian Co-Investment Fund,3,,,,,
iFood,$1.00 ,11/13/18,2018,Brazil,"Supply chain, logistics, & delivery","Movile, Just Eat, Naspers",Movile,3,,,,,
Geek+,$1.00 ,11/21/18,2018,China,Hardware,"Volcanics Ventures, Vertex Ventures China, Warburg Pincus",Volcanics Ventures,3,,,,,
REEF Technology,$1.00 ,12/10/18,2018,United States,"Supply chain, logistics, & delivery","Target Global, UBS Asset Management, Mubadala Capital",Target Global,3,,,,,
Globality,$1.00 ,1/22/19,2019,United States,Artificial intelligence,SoftBank Group,#VALUE!,1,,,,,
Ynsect,$1.00 ,2/21/19,2019,France,Other,"Astanor Ventures, Upfront Ventures, IDInvest Partners",Astanor Ventures,3,,,,,
Intellifusion,$1.00 ,3/22/19,2019,China,Artificial intelligence,"BOC International, TopoScend Capital, Hongxiu VC",BOC International,3,,,,,
Liquid,$1.00 ,4/3/19,2019,Japan,Fintech,"JAFCO Co, Bitmain Technologies, IDG Capital",JAFCO Co,3,,,,,
Poizon,$1.00 ,4/29/19,2019,China,Mobile & telecommunications,"DST Global, Sequoia Capital China, Gaorong Capital",DST Global,3,,,,,
VTS,$1.00 ,5/7/19,2019,United States,Internet software & services,"Trinity Ventures, Fifth Wall Ventures, OpenView Venture Partners",Trinity Ventures,3,,,,,
SITECH DEV,$1.00 ,5/16/19,2019,China,Other,China Prosperity Capital,#VALUE!,1,,,,,
KnowBox,$1.00 ,5/30/19,2019,China,Edtech,"TAL Education Group, Legend Star, Alibaba Group",TAL Education Group,3,,,,,
Yanolja,$1.00 ,6/10/19,2019,South Korea,Travel,"SBI Investment Korea, Partners Investment, GIC",SBI Investment Korea,3,,,,,
Meero,$1.00 ,6/18/19,2019,France,Artificial intelligence,"Aglae Ventures, Global Founders Capital, Alven Capital",Aglae Ventures,3,,,,,
SumUp,$1.00 ,7/16/19,2019,United Kingdom,Fintech,"American Express Ventures, Goldman Sachs, Bain Capital Credit",American Express Ventures,3,,,,,
Ibotta,$1.00 ,8/6/19,2019,United States,Fintech,"Koch Disruptive Technologies, Teamworthy Ventures, GGV Capital",Koch Disruptive Technologies,3,,,,,
C2FO,$1.00 ,8/7/19,2019,United States,Fintech,"Union Square Ventures, Summerhill Venture Partners, Mithril Capital Management",Union Square Ventures,3,,,,,
