HighRadius,$3.10 ,1/7/20,2020,United States,Fintech,"Susquehanna Growth Equity, Citi Ventures, ICONIQ Capital",Susquehanna Growth Equity,3,,,,,
Gorillas,$3.10 ,3/25/21,2021,Germany,E-commerce & direct-to-consumer,"Coatue Management, Atlantic Food Labs, DST Global",Coatue Management,3,,,,,
Nuvemshop,$3.10 ,8/17/21,2021,Brazil,E-commerce & direct-to-consumer,"Kaszek Ventures, Qualcomm Ventures, Accel",Kaszek Ventures,3,,,,,
VANCL,$3.00 ,12/14/10,2010,China,E-commerce & direct-to-consumer,"Ceyuan Ventures, QiMing Venture Partners, Temasek Holdings",Ceyuan Ventures,3,,,,,
Yixia,$3.00 ,11/24/15,2015,China,Mobile & telecommunications,"Sequoia Capital China, Sina Weibo, Kleiner Perkins Caufield & Byers, Redpoint Ventures",Sequoia Capital China,4,,,,,
Age of Learning,$3.00 ,5/3/16,2016,United States,Edtech,Iconiq Capital,#VALUE!,1,,,,,
Traveloka,$3.00 ,1/1/17,2017,Indonesia,Travel,"Global Founders Capital, East Ventures, Expedia Inc.",Global Founders Capital,3,,,,,
SouChe Holdings,$3.00 ,11/1/17,2017,China,E-commerce & direct-to-consumer,"Morningside Ventures, Warburg Pincus, CreditEase Fintech Investment Fund",Morningside Ventures,3,,,,,
BGL Group,$3.00 ,11/24/17,2017,United Kingdom,Fintech,CPP Investment Board,#VALUE!,1,,,,,
Circle,$3.00 ,5/15/18,2018,United States,Fintech,"General Catalyst, Digital Currency Group, Accel",General Catalyst,3,,,,,
Zuoyebang,$3.00 ,7/18/18,2018,China,Edtech,"Sequoia Capital China, Xiang He Capital, GGV Capital",Sequoia Capital China,3,,,,,
Seismic,$3.00 ,12/18/18,2018,United States,Internet software & services,"Jackson Square Ventures, General Atlantic, Lightspeed Venture Partners",Jackson Square Ventures,3,,,,,
Delhivery,$3.00 ,2/27/19,2019,India,"Supply chain, logistics, & delivery","Times Internet, Nexus Venture Partners, SoftBank Group",Times Internet,3,,,,,
FlixMobility,$3.00 ,7/18/19,2019,Germany,Auto & transportation,"Holtzbrinck Ventures, Unternehmertum Venture Capital, General Atlantic",Holtzbrinck Ventures,3,,,,,
CMR Surgical,$3.00 ,9/17/19,2019,United Kingdom,Health,"Cambridge Innovation Capital, LGT Capital Partners, Escala Capital",Cambridge Innovation Capital,3,,,,,
KK Group,$3.00 ,10/23/19,2019,China,E-commerce & direct-to-consumer,"Matrix Partners China, Bright Venture Capita, Shenzhen Capital Group",Matrix Partners China,3,,,,,
Wildlife Studios,$3.00 ,12/5/19,2019,Brazil,Other,"Benchmark, Bessemer Venture Partners",Benchmark,2,,,,,
Pine Labs,$3.00 ,1/24/20,2020,India,Fintech,"Sequoia Capital India, Temasek, PayPal Ventures",Sequoia Capital India,3,,,,,
Podium,$3.00 ,4/7/20,2020,United States,Internet software & services,"Accel, Summit Partners, Google Ventures",Accel,3,,,,,
ApplyBoard,$3.00 ,5/5/20,2020,Canada,Edtech,"Artiman Ventures, Plug and Play Ventures, Anthos Capital",Artiman Ventures,3,,,,,
Forter,$3.00 ,11/19/20,2020,United States,Cybersecurity,"Sequoia Capital Israel, Scale Venture Partners, Commerce Ventures",Sequoia Capital Israel,3,,,,,
Calendly,$3.00 ,1/26/21,2021,United States,Internet software & services,"ICONIQ Capital, OpenView Venture Partners",ICONIQ Capital,2,,,,,
BlockFi,$3.00 ,3/11/21,2021,United States,Fintech,"ConsenSys Ventures, Valar Ventures, PUC",ConsenSys Ventures,3,,,,,
Hopper,$3.00 ,3/24/21,2021,Canada,Travel,"Capital One Growth Ventures, Citi Ventures, OMERS Ventures",Capital One Growth Ventures,3,,,,,
Groww,$3.00 ,4/7/21,2021,India,Fintech,"Tiger Global Management, Sequoia Capital India, Ribbit Capital",Tiger Global Management,3,,,,,
Outschool,$3.00 ,4/14/21,2021,United States,Edtech,"Uniion Square Ventures, Tiger Global Management, Lightspeed Venture Capital",Uniion Square Ventures,3,,,,,
ActiveCampaign,$3.00 ,4/21/21,2021,United States,Internet software & services,"Silversmith Capital Partners, Susquehanna Growth Equity, Tiger Global Management",Silversmith Capital Partners,3,,,,,
Lucid Software,$3.00 ,6/29/21,2021,United States,Internet software & services,"Spectrum Equity, ICONIQ Capital, Grayhawk Capital",Spectrum Equity,3,,,,,
Carbon Health,$3.00 ,7/21/21,2021,United States,Health,"Brookfield Asset Management, Blackstone, Data Collective",Brookfield Asset Management,3,,,,,
Contentful,$3.00 ,7/28/21,2021,Germany,Internet software & services,"Balderton Capital, General Catalyst, Tiger Global Management",Balderton Capital,3,,,,,
LaunchDarkly,$3.00 ,7/28/21,2021,United States,Internet software & services,"Uncork Capital, Threshold Ventures, Bloomberg Beta",Uncork Capital,3,,,,,
Grafana Labs,$3.00 ,8/24/21,2021,United States,Internet software & services,"Lightspeed Venture Partners, Lead Edge Capital, Coatue Management",Lightspeed Venture Partners,3,,,,,
Sky Mavis,$3.00 ,10/4/21,2021,Vietnam,Internet software & services,"Fabric Ventures, 500 Global, Standard Crypto",Fabric Ventures,3,,,,,
TradingView,$3.00 ,10/14/21,2021,United States,Fintech,"Tiger Global Management, Insight Partners, Jump Capital",Tiger Global Management,3,,,,,
Anchorage Digital,$3.00 ,12/15/21,2021,United States,Fintech,"Andreessen Horowitz, Blockchain Capital, Lux Capital",Andreessen Horowitz,3,,,,,
Kraken,$2.92 ,6/25/19,2019,United States,Fintech,"Bnk To The Future, Trammell Ventures, SBI Investment",Bnk To The Future,3,,,,,
OpenAI,$2.92 ,7/22/19,2019,United States,Artificial intelligence,Khosla Ventures,#VALUE!,1,,,,,
Ovo,$2.90 ,3/14/19,2019,Indonesia,Fintech,"Grab, Tokopedia, Tokyo Century Corporation",Grab,3,,,,,
Workrise,$2.90 ,9/30/19,2019,United States,Internet software & services,"Founders Fund, Quantum Energy Partners, Bedrock Capital",Founders Fund,3,,,,,
Loft,$2.90 ,1/3/20,2020,Brazil,E-commerce & direct-to-consumer,"Monashees+, Andreessen Horowitz, QED Investors",Monashees+,3,,,,,
BharatPe,$2.85 ,7/30/21,2021,India,Fintech,"Insight Partners, Sequoia Capital India, BEENEXT",Insight Partners,3,,,,,
DriveWealth,$2.85 ,8/20/21,2021,United States,Fintech,"Point72 Ventures, Route 66 Ventures, Accel",Point72 Ventures,3,,,,,
Flink,$2.85 ,12/1/21,2021,Germany,E-commerce & direct-to-consumer,"Mubadala Capital, Bond, Prosus Ventures",Mubadala Capital,3,,,,,
Meicai,$2.80 ,6/22/16,2016,China,Mobile & telecommunications,"Tiger Global Management, Blue Lake Capital, ZhenFund",Tiger Global Management,3,,,,,
Zipline,$2.80 ,5/20/19,2019,United States,"Supply chain, logistics, & delivery","Sequoia Capital, Baillie Gifford & Co., Google Ventures",Sequoia Capital,3,,,,,
Icertis,$2.80 ,7/17/19,2019,United States,Artificial intelligence,"Eight Roads Ventures, Greycroft, Ignition Partners",Eight Roads Ventures,3,,,,,
Weee!,$2.80 ,3/16/21,2021,United States,"Supply chain, logistics, & delivery","Goodwater Capital, iFly, XVC Venture Capital",Goodwater Capital,3,,,,,
ContentSquare,$2.80 ,5/25/21,2021,France,Internet software & services,"Highland Europe, Eurazeo, Canaan Partners",Highland Europe,3,,,,,
Graphcore,$2.77 ,12/18/18,2018,United Kingdom,Artificial intelligence,"Dell Technologies Capital, Pitango Venture Capital, Amadeus Capital Partners",Dell Technologies Capital,3,,,,,
Illumio,$2.75 ,4/14/15,2015,United States,Cybersecurity,"Data Collective, Formation 8, General Catalyst Partners",Data Collective,3,,,,,
Convoy,$2.75 ,9/21/18,2018,United States,"Supply chain, logistics, & delivery","Greylock Partners, capitalG, Y Combinator",Greylock Partners,3,,,,,
MasterClass,$2.75 ,5/13/21,2021,United States,Edtech,"Institutional Venture Partners, New Enterprise Associates, Javelin Venture Partners",Institutional Venture Partners,3,,,,,
Transmit Security,$2.74 ,6/22/21,2021,Israel,Cybersecurity,"General Atlantic, Insight Partners, Vintage Investment Partners",General Atlantic,3,,,,,
Hozon Auto,$2.74 ,10/25/21,2021,China,Auto & transportation,"HD Capital, Qihoo 360 Technology, China Fortune Land Development",HD Capital,3,,,,,
Tradeshift,$2.70 ,5/30/18,2018,United States,Fintech,"Notion Capital, Scentan Ventures, Kite Ventures",Notion Capital,3,,,,,
Ola Electric Mobility,$2.70 ,7/2/19,2019,India,Auto & transportation,"SoftBank Group, Tiger Global Management, Matrix Partners India",SoftBank Group,3,,,,,
Ethos Technologies,$2.70 ,5/11/21,2021,United States,Fintech,"Sequoia Capital, Google Ventures, Accel",Sequoia Capital,3,,,,,
Nextiva,$2.70 ,9/14/21,2021,United States,Internet software & services,Goldman Sachs Asset Management,#VALUE!,1,,,,,
Sourcegraph,$2.62 ,7/13/21,2021,United States,Internet software & services,"Redpoint Ventures, Goldcrest Capital, Insight Partners",Redpoint Ventures,3,,,,,
JumpCloud,$2.62 ,9/13/21,2021,United States,Data management & analytics,"Foundry Group, General Atlantic, BlackRock",Foundry Group,3,,,,,
Pendo,$2.60 ,10/17/19,2019,United States,Internet software & services,"Contour Venture Partners, Battery Ventures, Core Capital Partners",Contour Venture Partners,3,,,,,
Plume,$2.60 ,2/23/21,2021,United States,Internet software & services,"Insight Partners, Jackson Square Ventures, Liberty Gloval Ventures",Insight Partners,3,,,,,
ManoMano,$2.60 ,7/5/21,2021,France,E-commerce & direct-to-consumer,"General Atlantic, Piton Capital, Partech Partners",General Atlantic,3,,,,,
Vista Global,$2.50 ,8/23/17,2017,United Arab Emirates,Other,Rhone Capital,#VALUE!,1,,,,,
BYTON,$2.50 ,4/20/18,2018,China,Auto & transportation,"FAW Group, Tencent Holdings, Tus Holdings",FAW Group,3,,,,,
Acronis,$2.50 ,9/18/19,2019,Switzerland,Cybersecurity,"Goldman Sachs, VebVentures, Insight Partners",Goldman Sachs,3,,,,,
Lenskart,$2.50 ,12/20/19,2019,India,E-commerce & direct-to-consumer,"Chiratae Ventures, PremjiInvest, Softbank",Chiratae Ventures,3,,,,,
Cato Networks,$2.50 ,11/17/20,2020,Israel,Cybersecurity,"Aspect Ventures, SingTel Innov8, Greylock Partners",Aspect Ventures,3,,,,,
Infra.Market,$2.50 ,2/25/21,2021,India,E-commerce & direct-to-consumer,"Accel, Tiger Global Management, Nexus Venture Partners",Accel,3,,,,,
Side,$2.50 ,3/22/21,2021,United States,Internet software & services,"Coatue Managemeny, Trinity Ventures, Matrix Partners",Coatue Managemeny,3,,,,,
Sysdig,$2.50 ,4/28/21,2021,United States,Cybersecurity,"Accel, Bain Capital Ventures, Insight Partners",Accel,3,,,,,
Aura,$2.50 ,6/9/21,2021,United States,Cybersecurity,"Warburg Pincus, General Catalyst",Warburg Pincus,2,,,,,
Vercel,$2.50 ,6/23/21,2021,United States,Internet software & services,"CRV, Accel, Google Ventures",CRV,3,,,,,
Zetwerk,$2.50 ,8/20/21,2021,India,Internet software & services,"Sequoia Capital India, Kae Capital, Accel",Sequoia Capital India,3,,,,,
Varo Bank,$2.50 ,9/9/21,2021,United States,Fintech,"Warburg Pincus, The Rise Fund, HarbourVest Partners",Warburg Pincus,3,,,,,
Uala,$2.45 ,8/13/21,2021,Argentina,Fintech,"Soros Fund Management, Ribbit Capital, Monashees+",Soros Fund Management,3,,,,,
Mobile Premier League,$2.45 ,9/15/21,2021,India,Internet software & services,"Sequoia Capital India, RTP Global, Go-Ventures",Sequoia Capital India,3,,,,,
Cybereason,$2.44 ,8/6/19,2019,United States,Cybersecurity,"SoftBank Group, CRV, Spark Capital",SoftBank Group,3,,,,,
Cgtz,$2.41 ,2/21/17,2017,China,Fintech,"Shunwei Capital Partners, China Media Group, Guangzhou Huiyin Aofeng Equity Investment Fund",Shunwei Capital Partners,3,,,,,
Star Charge,$2.41 ,5/19/21,2021,China,Auto & transportation,"Shunwei Capital Partners, China Media Group, Guangzhou Huiyin Aofeng Equity Investment Fund",Shunwei Capital Partners,3,,,,,
Carbon,$2.40 ,8/20/15,2015,United States,Hardware,"Google Ventures, Sequoia Capital, Wakefield Group",Google Ventures,3,,,,,
PolicyBazaar,$2.40 ,5/6/19,2019,India,Fintech,"Info Edge, Softbank Capital",Info Edge,2,,,,,
Trumid,$2.40 ,7/15/20,2020,United States,Fintech,"T. Rowe Price, Dragoneer Investment Group, BlackRock",T. Rowe Price,3,,,,,
ABL Space Systems,$2.40 ,3/25/21,2021,United States,Other,"T. Rowe Price, Lockheed Martin Ventures, Fidelity Investment",T. Rowe Price,3,,,,,
Paxos,$2.40 ,4/29/21,2021,United States,Fintech,"Liberty City Ventures, RRE Ventures, Mithril Capital Management",Liberty City Ventures,3,,,,,
Exabeam,$2.40 ,6/1/21,2021,United States,Cybersecurity,"Norwest Venture Partners, Aspect Ventures, Lightspeed Venture Partners",Norwest Venture Partners,3,,,,,
BitSight Technologies,$2.40 ,9/13/21,2021,United States,Cybersecurity,"Menlo Ventures, GGV Capital, Flybridge Capital Partners",Menlo Ventures,3,,,,,
Bought By Many,$2.35 ,6/1/21,2021,United Kingdom,Fintech,"Octopus Ventures, Munich Re Ventures, CommerzVentures",Octopus Ventures,3,,,,,
Jobandtalent,$2.35 ,12/1/21,2021,Spain,Internet software & services,"Kibo Ventures, SoftBank Group, Atomico",Kibo Ventures,3,,,,,
WEMAKEPRICE,$2.34 ,9/9/15,2015,South Korea,E-commerce & direct-to-consumer,"IMM Investment, NXC",IMM Investment,2,,,,,
Biren Technology,$2.32 ,8/18/20,2020,China,Hardware,"V FUND, IDG Capital, Green Pine Capital Partners",V FUND,3,,,,,
Voodoo,$2.31 ,8/17/20,2020,France,Other,"Tencent Holdings, Goldman Sachs",Tencent Holdings,2,,,,,
Uptake,$2.30 ,10/27/15,2015,United States,Artificial intelligence,"Revolution, New Enterprise Associates, Caterpillar",Revolution,3,,,,,
KeepTruckin,$2.30 ,4/23/19,2019,United States,"Supply chain, logistics, & delivery","Google Ventures, Index Ventures, Scale Venture Partners",Google Ventures,3,,,,,
Skydance Media,$2.30 ,2/11/20,2020,United States,Other,"RedBird Capital Partners, CJ ENM, Tencent Holdings",RedBird Capital Partners,3,,,,,
Greenlight,$2.30 ,9/24/20,2020,United States,Fintech,"Relay Ventures, TTV Capital, Canapi Ventures",Relay Ventures,3,,,,,
Highspot,$2.30 ,2/22/21,2021,United States,Internet software & services,"Madrona Venture Group, Shasta Ventures, Salesforce Ventures",Madrona Venture Group,3,,,,,
Bowery Farming,$2.30 ,5/25/21,2021,United States,Other,"Temasek, Google Ventures, General Catalyst",Temasek,3,,,,,
Odoo,$2.30 ,7/29/21,2021,Belgium,Internet software & services,"Summit Partners, Noshaq, Sofinnova Partners",Summit Partners,3,,,,,
MoMo,$2.27 ,12/10/21,2021,Vietnam,Fintech,"Goodwater Capital, Warburg Pincus, GS Growth",Goodwater Capital,3,,,,,
Zume,$2.25 ,11/1/18,2018,United States,Consumer & retail,"Softbank Group, AME Cloud Ventures, SignalFire",Softbank Group,3,,,,,
Algolia,$2.25 ,7/28/21,2021,United States,Internet software & services,"Accel, Alven Capital, Storm Ventures",Accel,3,,,,,
Pattern,$2.25 ,10/6/21,2021,United States,Internet software & services,"Knox Lane, Ainge Advisory, Carlson Private Capital Partners,/td>",Knox Lane,4,,,,,
NuCom Group,$2.20 ,2/22/18,2018,Germany,Other,General Atlantic,#VALUE!,1,,,,,
Gympass,$2.20 ,6/12/19,2019,United States,Internet software & services,"General Atlantic, SoftBank Group, Atomico",General Atlantic,3,,,,,
MUSINSA,$2.20 ,11/11/19,2019,South Korea,E-commerce & direct-to-consumer,Sequoia Capital,#VALUE!,1,,,,,
Dialpad,$2.20 ,10/6/20,2020,United States,Internet software & services,"Andreessen Horowitz, Google Ventures, Section 32",Andreessen Horowitz,3,,,,,
Current,$2.20 ,4/27/21,2021,United States,Fintech,"Expa, QED Investors, Foundation Capital",Expa,3,,,,,
Bitso,$2.20 ,5/5/21,2021,Mexico,Fintech,"Pantera Capital, QED Investors, Coinbase Ventures",Pantera Capital,3,,,,,
Reify Health,$2.20 ,8/10/21,2021,United States,Health,"Sierra Ventures, Battery Ventures, Asset Management Ventures",Sierra Ventures,3,,,,,
Huaqin Telecom Technology,$2.19 ,10/8/19,2019,China,Mobile & telecommunications,"Zhangjiang Haocheng Venture Capital, Walden International, Intel Capital",Zhangjiang Haocheng Venture Capital,3,,,,,
YITU Technology,$2.17 ,3/8/18,2018,China,Artificial intelligence,"Sequoia Capital China, Banyan Capital",Sequoia Capital China,2,,,,,
Addepar,$2.17 ,6/15/21,2021,United States,Fintech,"8VC, D1 Capital Partners, Sway Ventures",8VC,3,,,,,
Neo4j,$2.15 ,6/17/21,2021,United States,Data management & analytics,"Eight Roads Ventures, One Peak Partners, Creandum",Eight Roads Ventures,3,,,,,
1,$2.15 ,9/8/21,2021,Brazil,Fintech,"Plug and Play Ventures, Valor Capital Group, DST Global",Plug and Play Ventures,3,,,,,
SoundHound,$2.10 ,5/3/18,2018,United States,Artificial intelligence,"Tencent Holdings, Walden Venture Capital, Global Catalyst Partnera",Tencent Holdings,3,,,,,
FirstCry,$2.10 ,2/7/20,2020,India,E-commerce & direct-to-consumer,"SoftBank Group, SAIF Partners India, Valiant Capital Partners",SoftBank Group,3,,,,,
Eightfold.ai,$2.10 ,10/27/20,2020,United States,Internet software & services,"Foundation Capital, Institutional Venture Partners, General Catalyst",Foundation Capital,3,,,,,
Webflow,$2.10 ,1/13/21,2021,United States,Internet software & services,"Accel, Silversmith Capital Partners, capitalG",Accel,3,,,,,
6Sense,$2.10 ,3/30/21,2021,United States,Artificial intelligence,"Venrock, Battery Ventures, Insight Partners",Venrock,3,,,,,
Urban Company,$2.10 ,4/27/21,2021,India,E-commerce & direct-to-consumer,"VY Capital, Accel, Elevation Capital",VY Capital,3,,,,,
ReCharge,$2.10 ,5/6/21,2021,United States,Fintech,"ICONIQ Growth, Bain Capital Ventures, Summit Partners",ICONIQ Growth,3,,,,,
Moveworks,$2.10 ,6/30/21,2021,United States,Artificial intelligence,"Lightspeed Venture Partners, Sapphire Ventures, Kleiner Perkins Caufield & Byers",Lightspeed Venture Partners,3,,,,,
Medable,$2.10 ,10/26/21,2021,United States,Internet software & services,"GSR Ventures, Sapphire Ventures, Streamlined Ventures",GSR Ventures,3,,,,,
Trendy Group International,$2.00 ,2/13/12,2012,Hong Kong,Consumer & retail,L Capital Partners,#VALUE!,1,,,,,
Avant,$2.00 ,12/17/12,2012,United States,Artificial intelligence,"RRE Ventures, Tiger Global, August Capital",RRE Ventures,3,,,,,
Magic Leap,$2.00 ,10/21/14,2014,United States,Hardware,"Obvious Ventures, Qualcomm Ventures, Andreessen Horowitz",Obvious Ventures,3,,,,,
Tubatu.com,$2.00 ,3/9/15,2015,China,E-commerce & direct-to-consumer,"Sequoia Capital China, Matrix Partners China, 58.com",Sequoia Capital China,3,,,,,
BlaBlaCar,$2.00 ,9/16/15,2015,France,Auto & transportation,"Accel Partners, Index Ventures, Insight Venture Partners",Accel Partners,3,,,,,
Quanergy Systems,$2.00 ,8/22/16,2016,United States,Auto & transportation,"Delphi Automotive, Samsung Ventures, Motus Ventures",Delphi Automotive,3,,,,,
HuiMin,$2.00 ,9/5/16,2016,China,E-commerce & direct-to-consumer,"Zheshang Venture Capital, GP Capital, Western Capital Management",Zheshang Venture Capital,3,,,,,
Quora,$2.00 ,4/21/17,2017,United States,Internet software & services,"Y Combinator, Matrix Partners, Benchmark",Y Combinator,3,,,,,
Improbable,$2.00 ,5/11/17,2017,United Kingdom,Other,"Andreessen Horowitz, SoftBank Group, Temasek Holdings",Andreessen Horowitz,3,,,,,
Xinchao Media,$2.00 ,4/9/18,2018,China,Internet software & services,"JD.com, Baidu, Vision Plus Capital",JD.com,3,,,,,
Preferred Networks,$2.00 ,5/17/18,2018,Japan,Artificial intelligence,"Toyota Motor Corporation, Mizuho Financial Group, FANUC",Toyota Motor Corporation,3,,,,,
Formlabs,$2.00 ,8/1/18,2018,United States,Hardware,"Pitango Venture Capital, DFJ Growth Fund, Foundry Group",Pitango Venture Capital,3,,,,,
4Paradigm,$2.00 ,12/19/18,2018,China,Artificial intelligence,"Sequoia Capital China, China Construction Bank, Bank of China",Sequoia Capital China,3,,,,,
Calm,$2.00 ,2/6/19,2019,United States,Consumer & retail,"Insight Venture Partners, TPG Growth, Sound Ventures",Insight Venture Partners,3,,,,,
OCSiAl,$2.00 ,3/4/19,2019,Luxembourg,Other,"A&NN, Rusnano",A&NN,2,,,,,
Kaseya,$2.00 ,3/27/19,2019,United States,Cybersecurity,"Insight Partners, TPG Alternative & Renewable Technologies, Ireland Strategic Investment Fund",Insight Partners,3,,,,,
Mafengwo,$2.00 ,5/23/19,2019,China,Travel,"Qiming Venture Partners, Capital Today, General Atlantic",Qiming Venture Partners,3,,,,,
Loggi,$2.00 ,6/5/19,2019,Brazil,"Supply chain, logistics, & delivery","Qualcomm Ventures, SoftBank Group. Monashees+",Qualcomm Ventures,2,,,,,
Druva,$2.00 ,6/20/19,2019,United States,Data management & analytics,"Nexus Venture Partners, Tenaya Capital, Sequoia Capital",Nexus Venture Partners,3,,,,,
SmartNews,$2.00 ,8/5/19,2019,Japan,Mobile & telecommunications,"Japan Post Capital, Globis Capital Partners, Atomico",Japan Post Capital,3,,,,,
Kujiale,$2.00 ,10/25/19,2019,China,Internet software & services,"GGV Capital, IDG Capital, Linear Venture",GGV Capital,3,,,,,
AppsFlyer,$2.00 ,1/21/20,2020,United States,Mobile & telecommunications,"Magma Venture Partners, Pitango Venture Capital, Qumra Capital",Magma Venture Partners,3,,,,,
Keep,$2.00 ,5/19/20,2020,China,Mobile & telecommunications,"Bertelsmann Asia Investments, GGV Capital, Morningside Venture Capital",Bertelsmann Asia Investments,3,,,,,
Apeel Sciences,$2.00 ,5/26/20,2020,United States,Other,"Upfront Ventures, Tao Capital Partners, Andreessen Horowitz",Upfront Ventures,3,,,,,
Pagaya,$2.00 ,6/17/20,2020,Israel,Fintech,"Oak HC/FT Partners, GF Investments, Harvey Golub Family Office",Oak HC/FT Partners,3,,,,,
Redis Labs,$2.00 ,8/25/20,2020,United States,Data management & analytics,"Viola Ventures, Dell Technologies Capital, Bain Capital Ventures",Viola Ventures,3,,,,,
Xingyun Group,$2.00 ,9/24/20,2020,China,E-commerce & direct-to-consumer,"Matrix Partners China, Eastern Bell Capital, Hongtai Capital Holdings",Matrix Partners China,3,,,,,
Unqork,$2.00 ,10/6/20,2020,United States,Fintech,"Blackrock, capitalG, World Lab Innovation",Blackrock,3,,,,,
Virta Health,$2.00 ,12/2/20,2020,United States,Health,"Caffeinated Capital, Obvious Ventures, Venrock",Caffeinated Capital,3,,,,,
ISN,$2.00 ,12/17/20,2020,United States,"Supply chain, logistics, & delivery",Blackstone,#VALUE!,1,,,,,
Earnix,$2.00 ,2/21/21,2021,Israel,Fintech,"Jerusalem Venture Partners, Israel Growth Partners, Insight Partners",Jerusalem Venture Partners,3,,,,,
Guoquan Shihui,$2.00 ,3/17/21,2021,China,Consumer & retail,"Tiantu Capital, CMB International Capital, Vision Knight Capital",Tiantu Capital,3,,,,,
Arrail Dental,$2.00 ,4/13/21,2021,China,Health,"Qiming Venture Partners, Kleiner Perkins Caufield & Byers, OrbiMed Advisors",Qiming Venture Partners,3,,,,,
Clearco,$2.00 ,4/20/21,2021,Canada,Fintech,"Highland Capital Partners, Oak HC/FT Partners, Emergence Capital Partners",Highland Capital Partners,3,,,,,
Hive,$2.00 ,4/21/21,2021,United States,Artificial intelligence,"Tomales Bay Capital, Bain & Company, General Catalyst",Tomales Bay Capital,3,,,,,
Misfits Market,$2.00 ,4/21/21,2021,United States,E-commerce & direct-to-consumer,"Accel, D1 Capita Partners, Greenoaks Capital Management",Accel,3,,,,,
KRY,$2.00 ,4/27/21,2021,Sweden,Health,"Index Ventures, Creandum, Accel",Index Ventures,3,,,,,
Kajabi,$2.00 ,5/4/21,2021,United States,Internet software & services,"Meritech Capital Partners, Tiger Global Management, Spectrum Equity",Meritech Capital Partners,3,,,,,
Beisen,$2.00 ,5/11/21,2021,China,Internet software & services,"Matrix Partners China, Sequoia Capital China, Genesis Capital",Matrix Partners China,3,,,,,
Pipe,$2.00 ,5/19/21,2021,United States,Fintech,"next47, MaC Venture Capital, FinVC",next47,3,,,,,
Chipper Cash,$2.00 ,6/1/21,2021,United States,Fintech,"Deciens Capital, Bezos Expeditions, 500 Startups",Deciens Capital,3,,,,,
VerbIT,$2.00 ,6/8/21,2021,Israel,Artificial intelligence,"ClalTech, Vertex Ventures, Oryzn Capital",ClalTech,3,,,,,
Clip,$2.00 ,6/10/21,2021,Mexico,Fintech,"Alta Ventures Mexico, General Atlantic, SoftBank Group",Alta Ventures Mexico,3,,,,,
Iterable,$2.00 ,6/15/21,2021,United States,Internet software & services,"CRV, Blue Cloud Ventures, Index Ventures",CRV,3,,,,,
Bunq,$2.00 ,6/18/21,2021,Netherlands,Fintech,Undisclosed,#VALUE!,1,,,,,
1Password,$2.00 ,7/8/21,2021,Canada,Cybersecurity,"Slack Fund, Accel, Skip Capital",Slack Fund,3,,,,,
MURAL,$2.00 ,7/20/21,2021,United States,Internet software & services,"Insight Partners, Tiger Global Management, Gradient Ventures",Insight Partners,3,,,,,
XtalPi,$2.00 ,8/11/21,2021,China,Artificial intelligence,"Tencent Holdings, 5Y Capital, Sequoia Capital China",Tencent Holdings,3,,,,,
Divvy Homes,$2.00 ,8/13/21,2021,United States,Fintech,"Andreessen Horowitz, Caffeinated Capital, SciFi VC",Andreessen Horowitz,3,,,,,
Opay,$2.00 ,8/23/21,2021,Nigeria,Fintech,"Sequoia Capital China, Source Code Capital, Redpoint Ventures China",Sequoia Capital China,3,,,,,
Aviatrix,$2.00 ,9/8/21,2021,Santa Clara,Internet software & services,"Ignition Partners, Formation 8, CRV",Ignition Partners,3,,,,,
Spring Health,$2.00 ,9/16/21,2021,United States,Health,"Rethink Impact, Work-Bench, RRE Ventures",Rethink Impact,3,,,,,
Black Sesame Technologies,$2.00 ,9/22/21,2021,China,Artificial intelligence,"Northern Light Venture Capital, Xiaomi, FutureX Capital",Northern Light Venture Capital,3,,,,,
Advance Intelligence Group,$2.00 ,9/23/21,2021,Singapore,Artificial intelligence,"Vision Plus Capital, GSR Ventures, ZhenFund",Vision Plus Capital,3,,,,,
Modern Treasury,$2.00 ,10/6/21,2021,United States,Fintech,"Benchmark, Altimeter Capital, Quiet Capital",Benchmark,3,,,,,
Aiven,$2.00 ,10/18/21,2021,Finland,Internet software & services,"Institutional Venture Partners, Atomico, Earlybird Venture Capital",Institutional Venture Partners,3,,,,,
Tier Mobility,$2.00 ,10/25/21,2021,Germany,Travel,"Northzone Ventures, White Star Capital, Novator Partners",Northzone Ventures,3,,,,,
ClickHouse,$2.00 ,10/28/21,2021,United States,Data management & analytics,"Lightspeed Venture Partners, Almaz Capital Partners, Altimeter Capital",Lightspeed Venture Partners,3,,,,,
Mynt,$2.00 ,10/28/21,2021,Philippines,Fintech,"Insight Partners, Warburg Pincus, Ayala Corporation",Insight Partners,3,,,,,
Everlaw,$2.00 ,11/2/21,2021,United States,Internet software & services,"K9 Ventures, Menlo Ventures, Andreessen Horowitz",K9 Ventures,3,,,,,
Zilch,$2.00 ,11/10/21,2021,United Kingdom,Fintech,"Gauss Ventures, Ventura Capital, dmg ventures",Gauss Ventures,3,,,,,
StarkWare,$2.00 ,11/17/21,2021,Israel,Cybersecurity,"Sequoia Capital, Paradigm, Pantera Capital",Sequoia Capital,3,,,,,
